{"decision_id":"CPR-DEC-EXAMPLE-001","run_id":"CPR-RUN-EXAMPLE-001","chapter_id":"CH-EXAMPLE","version_id":"v1","stage":"intake","recommendation":"ready_with_tracked_items","finding_ids":["CPR-FND-EXAMPLE-LATER"],"evidence_summary":"Required intake components are complete; biography is due at release.","rationale":"Current-stage gates pass and the later-stage item has an owner.","conditions":[],"signatory_role":"volume editor","signatory":null,"signed_at":null,"status":"recommendation_only","supersedes":null,"created_at":"2026-08-13T00:00:00Z"}
